{
  "schemaVersion": 1, "wave": "WAVE_16", "packet": "DS-16B", "verdict": "PASS", "verifiedBy": "Codex", "verifiedAt": "2026-08-08T21:45:00+03:00",
  "relatedRunIds": ["20260808-201439-168-implement"],
  "allowedPaths": ["src/truba_gui/ui/dialogs/transfer_dialog.py", "tests/test_ftp_widget.py"],
  "observedPaths": ["src/truba_gui/ui/dialogs/transfer_dialog.py", "tests/test_ftp_widget.py"],
  "diffStat": ["2 files changed, 65 changed lines"],
  "testsRun": [{"command": "$env:PYTHONPATH='src'; python -m pytest tests/test_ftp_widget.py -q", "exitCode": 0, "outcome": "PASS", "evidenceFile": ".agent-runs/20260808-201439-168-implement/metadata.json"}],
  "evidenceFiles": [".agent-runs/wave16-ds16b.log"], "reviewFindings": [], "resolutions": ["GUI-only publication is throttled while backend callbacks and final progress remain intact."], "remainingUncertainty": [],
  "capacity": {"size": "Small", "maxFiles": 3, "maxChangedLines": 200, "observedFiles": 2, "observedChangedLines": 65, "withinLimit": true}, "nextPermittedPacket": "DS-16C"
}
