{
  "schemaVersion": 1, "wave": "WAVE_16", "packet": "DS-16D", "verdict": "PASS", "verifiedBy": "Codex", "verifiedAt": "2026-08-08T21:45:00+03:00",
  "relatedRunIds": ["20260808-205831-370-implement", "20260808-212840-805-review"],
  "allowedPaths": ["src/truba_gui/ui/widgets/ftp_widget.py", "tests/test_ftp_widget.py"],
  "observedPaths": ["src/truba_gui/ui/widgets/ftp_widget.py", "tests/test_ftp_widget.py"],
  "diffStat": ["2 files changed, reduced focused test diff within Medium capacity"],
  "testsRun": [{"command": "$env:PYTHONPATH='src'; python -m pytest tests/test_ftp_widget.py -q", "exitCode": 0, "outcome": "PASS", "evidenceFile": ".agent-runs/20260808-205831-370-implement/metadata.json"}, {"command": "python -m pytest tests -q", "exitCode": 0, "outcome": "PASS", "evidenceFile": null}, {"command": "python scripts/check_i18n.py", "exitCode": 0, "outcome": "PASS", "evidenceFile": null}],
  "evidenceFiles": [".agent-runs/wave16-ds16d.log", ".agent-runs/wave16-ds16d-review-final.log"], "reviewFindings": ["Duplicate-item guard and stale progress cleanup were independently rechecked and fixed."], "resolutions": ["Visible lists now reconcile incrementally, preserving row and context-menu identity."], "remainingUncertainty": [],
  "capacity": {"size": "Medium", "maxFiles": 5, "maxChangedLines": 400, "observedFiles": 2, "observedChangedLines": 370, "withinLimit": true}, "nextPermittedPacket": null
}
